{"authentication":{"key_id":"0bf01e472fe9e08eafecf4c7fd4e2779432355b13a23238a8ca09a7446031404","scheme":"ed25519","signature":"b2c944c72cfdfb260b958b3b140e113577ebb9b2ba2e7ad3e3b177871d75e116fb11d57eef8137ea08d78df1f6a3bf64805a08cb946a28049d7392df95c2e10c","signed_payload_sha256":"c060f9e5a7de00f40bc54fe8f77f795dbfe5634591cb992b171cddf2683bf767"},"authorization_receipt_sha256":"af312bb95eca80a9dac6443df2e14549b0f7fd50a1e1972aeb0a765b73466dd6","bundle_sha256":"67330e6444fdb8876d8c162692b544a891cc47d15d8140c3bd92f0ab6e51d828","challenge_sha256":"5b88d9e8dccae6bec723ce55b54b5818f9520197f39a86a2e6a557616b1ccdce","cleanup":{"diagnostics":[],"status":"verified"},"completed_at":"2026-10-18T22:07:23Z","contract_sha256":"b40ca13272e1b0ce29a8dd489a22e727db287981a7d2d2d2e48301e5d6e96c47","dispatcher_abi":"whiny.dispatch.v1","loaded_files":[{"path":"dispatcher.dll","sha256":"af0df10d005a149c10dc3134e22e63a2e2962990d0aa5c164a5742dd57e10cdf"},{"path":"target/native_math.dll","sha256":"f1c49f073076e540e43592f7d12ecc27d8cb5a8c5983c6b6fd81f2924d4f60ee"}],"operation_id":1,"receipt_id":"native-scalar-891e9c4e-895b-45dc-9a6e-e4f66ed393ab","request_sha256":"a4026a1b788a19c6c9e9e49c6e370f1c52289826badf3d948da78e1d97d45f15","response_sha256":"e8a4b2ee7ede79a3afb332b5b6cc3d952a65fd8cffb897f5d18016577c33d7cc","runtime_identity":{"architecture":"x86-64","bridge_version":"0.2.0","host_id":"crossover-XOdeLabRPC","os_build":"macOS 27.0.1; CrossOver 26.3.0.39832"},"schema":"whiny.runtime-receipt.v1","sequence":1,"started_at":"2026-10-18T22:07:22Z","status":"ok"}