{"authentication":{"key_id":"0a0460068e77b3bf68c9ce600cd67d76740316826975b7ab7f62fbb40f6da1ef","scheme":"ed25519","signature":"20ee5aeca83289d5ce89b05a0e6e7339b6863766e42afbbe3b09ec084c226a0a985b90dcac0edbca2aa9ed607a5d7f283e701dfbc9b161f732ea57beab16e304","signed_payload_sha256":"433ecf45c249fd6f5bc577b1bc6d4d6f968740adc80ff9788e9d229764eab2fb"},"authorization_receipt_sha256":"48173a6fd7870060b978a9c4fabc7f71ca929ddea44ce6e95caeb362d4a05210","bundle_sha256":"0086d567312afc118e0e4b31dad37ac108af7428c0b718bf329b6115ed773678","challenge_sha256":"94f967252804718ec3308b7f089c3daac8c07f7f55249b29772910f041af0f41","cleanup":{"diagnostics":[],"status":"verified"},"completed_at":"2026-10-18T22:07:25Z","contract_sha256":"490ad75fcf53f28215e8464740ff7e5995b38a8cbef2f8f0626ef5a7ec2c5414","dispatcher_abi":"whiny.dispatch.v1","loaded_files":[{"path":"wvb_managed_host.dll","sha256":"2f8b176b05dad63c5a7488a3f6a4c17ce81eedab9d449c1a3734bcf8bcc7aa60"},{"path":"ExampleManagedMath.WhinyDispatcher.dll","sha256":"8f4c98ecc0e5ba10c6f409214d3c37cd51d42229a4aab4c787c2b37f519e97fa"},{"path":"Example.ManagedMath.dll","sha256":"23cacc61dcebbab73d78aa8e4c97b08f8f664bae4c7af0603b2a1c4beea2a0f5"},{"path":"ExampleManagedMath.WhinyDispatcher.runtimeconfig.json","sha256":"ca8666237d92cc378ef2cf0e34c09ec9f64ce3ed0b0e82d3333b83594da4cab0"},{"path":"nethost.dll","sha256":"b7ebee5df9d8e27aca714db5be487aba5f00a24687e2e920b385444ae4f085d0"},{"path":"hostfxr.dll","sha256":"d579c8d05dd7456be1551ab0cc3a86bd298b5cd5675936332cc4c8e56e59984d"}],"operation_id":1,"receipt_id":"managed-scalar-249ee538-62df-4b83-8339-5795da2db1ee","request_sha256":"a4026a1b788a19c6c9e9e49c6e370f1c52289826badf3d948da78e1d97d45f15","response_sha256":"e8a4b2ee7ede79a3afb332b5b6cc3d952a65fd8cffb897f5d18016577c33d7cc","runtime_identity":{"architecture":"x86-64","bridge_version":"0.2.0","host_id":"crossover-XOdeLabRPC","os_build":"macOS 27.0.1; CrossOver 26.3.0.39832"},"schema":"whiny.runtime-receipt.v1","sequence":2,"started_at":"2026-10-18T22:07:24Z","status":"ok"}