{"authentication":{"key_id":"d2bcd50e915b7962fd64d01ef0b3fdb80df632c0271bb6622f45fdb6f7c48b88","scheme":"ed25519","signature":"144837205c98d3587886869530a116779f5f71a05b39fd28eafd01a378e79ecb485fbc0b5aa57f83ab0565a92014828f137e6f09e253618c64dd3dabfd689e05","signed_payload_sha256":"6c4e8a087df34231978da0c87209b9ebbb9a10c7147fbddaf9e32d01619d56c6"},"authorization_receipt_sha256":"b385abfd206ff5ecb3f5181725fea9a88b0fe49cd916471b0d892467a25b995b","bundle_sha256":"0086d567312afc118e0e4b31dad37ac108af7428c0b718bf329b6115ed773678","challenge_sha256":"b40697155bbe4ee6d5aa6eda520958baad9545611ec48350cfca5d7b93fc583f","cleanup":{"diagnostics":[],"status":"verified"},"completed_at":"2026-10-19T19:39:04Z","contract_sha256":"490ad75fcf53f28215e8464740ff7e5995b38a8cbef2f8f0626ef5a7ec2c5414","dispatcher_abi":"whiny.dispatch.v1","loaded_files":[{"path":"runtime/host/nethost.dll","sha256":"b7ebee5df9d8e27aca714db5be487aba5f00a24687e2e920b385444ae4f085d0"},{"path":"runtime/dotnet/host/fxr/8.0.32/hostfxr.dll","sha256":"d579c8d05dd7456be1551ab0cc3a86bd298b5cd5675936332cc4c8e56e59984d"},{"path":"payload/wvb_managed_host.dll","sha256":"2f8b176b05dad63c5a7488a3f6a4c17ce81eedab9d449c1a3734bcf8bcc7aa60"},{"path":"payload/ExampleManagedMath.WhinyDispatcher.runtimeconfig.json","sha256":"ca8666237d92cc378ef2cf0e34c09ec9f64ce3ed0b0e82d3333b83594da4cab0"},{"path":"payload/ExampleManagedMath.WhinyDispatcher.dll","sha256":"8f4c98ecc0e5ba10c6f409214d3c37cd51d42229a4aab4c787c2b37f519e97fa"},{"path":"payload/Example.ManagedMath.dll","sha256":"23cacc61dcebbab73d78aa8e4c97b08f8f664bae4c7af0603b2a1c4beea2a0f5"}],"operation_id":1,"receipt_id":"d8b3b40c-ffcf-1591-6222-cce87648e945","request_sha256":"a4026a1b788a19c6c9e9e49c6e370f1c52289826badf3d948da78e1d97d45f15","response_sha256":"e8a4b2ee7ede79a3afb332b5b6cc3d952a65fd8cffb897f5d18016577c33d7cc","runtime_identity":{"architecture":"x86-64","bridge_version":"0.2.0","host_id":"utm-WhinyWindows11x64-F659FCF2","os_build":"Windows 11 10.0.26300.9457"},"schema":"whiny.runtime-receipt.v1","sequence":2,"started_at":"2026-10-19T19:39:02Z","status":"ok"}